{
  "$schema": "http://json-schema.org/draft-07/schema#",
  "$id": "fx.schema.json",
  "title": "flix_game_engine fx.json document",
  "description": "FxDoc が読む閉形式パーティクルの宣言ドキュメント。粒はどこにも保存されず、Fx.sample が (Spec, seed, t) から毎回計算する。'//' で始まるキーはコメントとして無視される。",
  "type": "object",
  "properties": {
    "$schema": { "type": "string" },
    "version": { "type": "integer", "enum": [1] },
    "name": { "type": "string", "description": "効果の名前" },
    "duration": { "type": "number", "exclusiveMinimum": 0, "description": "効果全体の長さ 秒。これを過ぎた時刻の sample は空になる" },
    "note": { "type": "string", "description": "エディタで表示するノートコメント（描画には影響しない）" },
    "emitters": {
      "type": "array", "minItems": 1,
      "items": { "$ref": "#/$defs/emitter" },
      "description": "粒の群れの宣言（1 個以上）。既定は burst（全粒が t=0 で同時に生まれる）— mode: loop で常時系（粒が寿命ごとに生まれ直す）"
    }
  },
  "required": ["name", "duration", "emitters"],
  "patternProperties": { "^//": {} },

  "$defs": {
    "color": {
      "oneOf": [
        { "type": "string", "pattern": "^#?[0-9a-fA-F]{6}$", "description": "\"#rrggbb\"" },
        { "type": "object", "properties": { "hsv": { "type": "array", "items": { "type": "number" }, "minItems": 3, "maxItems": 3 } },
          "required": ["hsv"], "additionalProperties": false,
          "description": "{\"hsv\":[h,s,v]} — h は 1 周 = 1.0" },
        { "type": "object", "properties": { "rgb": { "type": "array", "items": { "type": "number" }, "minItems": 3, "maxItems": 3 } },
          "required": ["rgb"], "additionalProperties": false,
          "description": "{\"rgb\":[r,g,b]} — 各 0.0..1.0" }
      ]
    },
    "vary": {
      "type": "number", "minimum": 0, "maximum": 1,
      "description": "粒ごとのばらつき 0..1 — base × (1 ± vary) の幅で決まる。省略時 0"
    },
    "curve": {
      "type": "object",
      "description": "正規化寿命 u（0 = 生まれた瞬間, 1 = 消える瞬間）→ 倍率、のカーブ。省略時は constant（いつでも 1.0）",
      "oneOf": [
        { "properties": { "kind": { "const": "constant" } },
          "required": ["kind"],
          "description": "いつでも 1.0（変化なし）" },
        { "properties": { "kind": { "const": "linear" },
                          "from": { "type": "number" }, "to": { "type": "number" } },
          "required": ["kind", "from", "to"],
          "description": "from から to へまっすぐ変わる" },
        { "properties": { "kind": { "const": "fadeOut" } },
          "required": ["kind"],
          "description": "linear {from: 1, to: 0} の別名（すーっと消える）" },
        { "properties": { "kind": { "const": "easeIn" },
                          "power": { "type": "number", "description": "省略時 2.0" } },
          "required": ["kind"],
          "description": "u^power — ゆっくり始まって加速しながら 0 → 1" },
        { "properties": { "kind": { "const": "easeOut" },
                          "power": { "type": "number", "description": "省略時 2.0" } },
          "required": ["kind"],
          "description": "(1-u)^power — 1 から始まり、速く出てだんだん弱まって 0 へ" },
        { "properties": { "kind": { "const": "peak" },
                          "at": { "type": "number", "minimum": 0, "maximum": 1 } },
          "required": ["kind", "at"],
          "description": "u = at で山（1.0）になる三角形 0 → 1 → 0（ふくらんで縮む）" },
        { "properties": { "kind": { "const": "flicker" },
                          "rate": { "type": "number", "description": "寿命あたりのチラつき回数" },
                          "amount": { "type": "number", "description": "1 から最大どれだけ暗くなるか。省略時 1.0" } },
          "required": ["kind", "rate"],
          "description": "決定論の疑似乱数で 1 から amount ぶんチラつく。speed.over には使えない" },
        { "properties": { "kind": { "const": "pulse" },
                          "rate": { "type": "number", "description": "寿命あたりの明滅回数" },
                          "min": { "type": "number", "minimum": 0, "maximum": 1, "description": "沈む下限 0..1。省略時 0（谷で消える）" } },
          "required": ["kind", "rate"],
          "description": "1 と min の間を正弦でなめらかに明滅する（u=0 は 1 から始まる）。flicker のガタつきと違い、蛍・信号灯の「ふわっ」とした点滅に。speed.over には使えない" }
      ]
    },
    "emitter": {
      "type": "object",
      "properties": {
        "name": { "type": "string", "description": "粒ごとの乱数の系統を分ける識別子（名前が違えば別の散り方）" },
        "count": { "type": "integer", "minimum": 1, "description": "粒の数" },
        "mode": { "type": "string", "enum": ["burst", "loop"], "description": "生まれ方。burst = 全粒が t=0 で同時に生まれる（爆発・木くず）。loop = 各粒が寿命を終えるたびに生まれ直す（周期 = 寿命・位相は粒ごとにずれる — 煙・雪・舞う葉）。省略時 burst" },
        "shape": { "type": "string", "enum": ["circle", "box", "glow", "streak"], "description": "粒の形。glow は縁がふわっと消える円 — にじみに明るさが配られるぶん同じ size では circle より細く見える(1.5 倍が目安)。streak はその時刻の速度の向きに伸びた筋（太さ = size・長さ = size + 速さ × stretch）— 雨・火花・流星に。省略時 circle" },
        "size": { "type": "number", "exclusiveMinimum": 0, "description": "粒の大きさ px（circle は直径・box は一辺）" },
        "color": {
          "type": "array", "minItems": 1,
          "items": { "$ref": "#/$defs/color" },
          "description": "1〜N 色の配列 — 寿命 t/life に沿った線形グラデ（1 色なら固定色）。parseWith 経由なら \"@名前\" でパレットの色キーを参照できる"
        },
        "life": {
          "type": "object",
          "properties": {
            "base": { "type": "number", "exclusiveMinimum": 0, "description": "粒の寿命 秒" },
            "vary": { "$ref": "#/$defs/vary" }
          },
          "required": ["base"],
          "description": "粒の寿命。尽きた粒は描かれない"
        },
        "speed": {
          "type": "object",
          "properties": {
            "base": { "type": "number", "description": "初速 px/s" },
            "vary": { "$ref": "#/$defs/vary" },
            "over": { "$ref": "#/$defs/curve", "description": "速度の倍率カーブ。位置はこの積分（閉形式）— flicker は不可" }
          },
          "required": ["base"],
          "description": "粒の飛ぶ速さ。省略時は動かない粒"
        },
        "dir": {
          "type": "object",
          "properties": {
            "base": { "type": "number", "description": "射出方向 度（0 = 真上・時計回り）" },
            "spread": { "type": "number", "description": "base を中心に ± spread/2 度の扇に散る。360 で全方位" },
            "mode": { "type": "string", "enum": ["random", "even"], "description": "扇の中の配り方。random = 粒ごとに乱数で引く（煙・火花）。even = 粒の番号 i で扇を等分する（spread: 360 で真円の輪・花火。乱数を引かないので種を変えても同じ形）。省略時 random" }
          },
          "description": "射出方向。省略時は真上・広がりなし・乱数"
        },
        "turn": {
          "type": "object",
          "properties": {
            "base": { "type": "number", "description": "生まれたときの傾き 回転数（1 周 = 1.0）" },
            "spread": { "type": "number", "minimum": 0, "description": "base を中心に ± spread/2 回転ぶん粒ごとにばらす。1 で全方位（向きがそろわない破片に）" },
            "spin": { "type": "number", "description": "回る速さ 回転数/秒（正 = 時計回り）" },
            "spinSpread": { "type": "number", "minimum": 0, "description": "spin を中心に ± spinSpread/2 ばらす。spin より大きくすると逆回りの粒も混ざる" }
          },
          "description": "粒の傾きと回る速さ。回るのは box だけ（circle / glow は回しても同じ絵なので傾けない。streak の向きは速度が決めるので turn は効かない）。省略時はすべて 0 = 回らない"
        },
        "wobble": {
          "type": "object",
          "properties": {
            "amp": {
              "type": "object",
              "properties": {
                "x": { "type": "number", "minimum": 0, "description": "横の揺れ幅 px" },
                "y": { "type": "number", "minimum": 0, "description": "縦の揺れ幅 px" }
              },
              "description": "揺れ幅（0 で揺れない）。省略時 {0, 0}"
            },
            "freq": {
              "type": "object",
              "properties": {
                "x": { "type": "number", "minimum": 0, "description": "横の揺れの速さ Hz" },
                "y": { "type": "number", "minimum": 0, "description": "縦の揺れの速さ Hz" }
              },
              "description": "揺れの速さ Hz（1 秒あたりの往復回数）。省略時 {0, 0}"
            },
            "vary": { "$ref": "#/$defs/vary", "description": "粒ごとの位相ばらつき 0..1（0 = 全粒そろって揺れる・1 = 1 周ぶん散る）。省略時 0" }
          },
          "description": "位置の正弦揺らぎ（閉形式で位置に足す）。x と y は別の位相を引くので、両軸に振ると蛍・湯気の「その場でゆらゆら」の有界運動になる。省略時は揺れない"
        },
        "stretch": { "type": "number", "minimum": 0, "description": "streak の尾の長さ 秒（長さ = size + 速さ × これ。shape が streak のときだけ効く）。省略時 0.05 — 速さ 200px/s で尾 10px" },
        "spawn": {
          "type": "object",
          "properties": {
            "w": { "type": "number", "minimum": 0, "description": "発生源の横幅 px" },
            "h": { "type": "number", "minimum": 0, "description": "発生源の縦幅 px" }
          },
          "description": "発生源の広がり（原点中心の矩形・粒ごとに一様乱数で散らす）。省略時は点"
        },
        "accel": {
          "type": "object",
          "properties": {
            "x": { "type": "number", "description": "横の加速度 px/s²（風 — 正 = 右）" },
            "y": { "type": "number", "description": "縦の加速度 px/s²（重力 — 正 = 画面下）" }
          },
          "description": "重力/風。位置には閉形式 ½at² で効く。省略時 {0, 0}"
        },
        "seed": { "type": "integer", "description": "決定的シードの上乗せ。同名 emitter を並べて別の散り方にする。省略時 0" },
        "sizeOver": { "$ref": "#/$defs/curve", "description": "大きさの倍率カーブ" },
        "alphaOver": { "$ref": "#/$defs/curve", "description": "透明度の倍率カーブ" },
        "blend": { "type": "string", "enum": ["normal", "add", "multiply"], "description": "重ね方。add は下の色に足し込む（重なるほど明るい — 火花・光向け）。省略時 normal" },
        "zIndex": { "type": "integer", "description": "描画順。省略時 0" }
      },
      "required": ["name", "count", "size", "color", "life"],
      "patternProperties": { "^//": {} }
    }
  }
}
