{
  "version": 1,
  "name": "nitro_flame",
  "note": "ニトロ発動中ずっと出る噴射炎。loop なので出続ける — World が発動中だけ t を渡して描く。裾(赤)・外炎(橙)・芯(白熱)・火の粉・きらめきの 5 層で階調を作る。灼けた路面の上では加算だけだと白く飛ぶので、炎の本体は通常合成で色を残し、加算は芯と粒だけに使う。",
  "duration": 10.0,
  "emitters": [
    {
      "name": "plume",
      "count": 14,
      "mode": "loop",
      "shape": "circle",
      "size": 15.0,
      "color": ["@flame", "@flameDeep"],
      "life": { "base": 0.38, "vary": 0.3 },
      "speed": { "base": 120.0, "vary": 0.35, "over": { "kind": "easeOut", "power": 1.5 } },
      "dir": { "base": 180.0, "spread": 34.0 },
      "spawn": { "w": 9.0, "h": 3.0 },
      "sizeOver": { "kind": "linear", "from": 0.8, "to": 1.7 },
      "alphaOver": { "kind": "linear", "from": 0.55, "to": 0.0 },
      "blend": "normal",
      "zIndex": 9
    },
    {
      "name": "outer",
      "count": 20,
      "mode": "loop",
      "shape": "circle",
      "size": 10.0,
      "color": ["@flameHot", "@flame", "@flameDeep"],
      "life": { "base": 0.3, "vary": 0.35 },
      "speed": { "base": 175.0, "vary": 0.3, "over": { "kind": "easeOut", "power": 1.4 } },
      "dir": { "base": 180.0, "spread": 22.0 },
      "spawn": { "w": 7.0, "h": 2.0 },
      "sizeOver": { "kind": "linear", "from": 1.2, "to": 0.3 },
      "alphaOver": { "kind": "fadeOut" },
      "blend": "normal",
      "zIndex": 10
    },
    {
      "name": "core",
      "count": 14,
      "mode": "loop",
      "shape": "circle",
      "size": 5.5,
      "color": ["#ffffff", "@flameCore", "@flameHot"],
      "life": { "base": 0.17, "vary": 0.4 },
      "speed": { "base": 230.0, "vary": 0.25, "over": { "kind": "easeOut", "power": 1.2 } },
      "dir": { "base": 180.0, "spread": 10.0 },
      "spawn": { "w": 4.0, "h": 2.0 },
      "sizeOver": { "kind": "linear", "from": 1.15, "to": 0.25 },
      "alphaOver": { "kind": "fadeOut" },
      "blend": "add",
      "zIndex": 11
    },
    {
      "name": "embers",
      "count": 16,
      "mode": "loop",
      "shape": "box",
      "size": 2.0,
      "color": ["@flameCore", "@spark", "@flame"],
      "life": { "base": 0.5, "vary": 0.5 },
      "speed": { "base": 210.0, "vary": 0.45, "over": { "kind": "easeOut", "power": 2.0 } },
      "dir": { "base": 180.0, "spread": 60.0 },
      "accel": { "x": 0.0, "y": 70.0 },
      "sizeOver": { "kind": "linear", "from": 1.0, "to": 0.3 },
      "alphaOver": { "kind": "fadeOut" },
      "blend": "add",
      "zIndex": 12
    },
    {
      "name": "sparkle",
      "count": 8,
      "mode": "loop",
      "shape": "box",
      "size": 1.4,
      "color": ["#ffffff", "@spark"],
      "life": { "base": 0.35, "vary": 0.6 },
      "speed": { "base": 290.0, "vary": 0.5, "over": { "kind": "easeOut", "power": 2.5 } },
      "dir": { "base": 180.0, "spread": 100.0 },
      "alphaOver": { "kind": "fadeOut" },
      "blend": "add",
      "zIndex": 13
    }
  ]
}
