{
  "version": 1,
  "name": "crash",
  "note": "クラッシュ（スピン開始）。閃光 → 衝撃の輪 → 火の玉 → 火の破片と黒い破片 → 膨らむ煙、の 5 段。最後の billow だけ loop なので、この効果が生きているあいだ（= スピンしているあいだ）煙が出続ける。duration はスピンの長さ（race.rules.json の spinDuration）に合わせてある。灼けた路面の上では加算だけだと白く飛ぶので、火の玉と破片は通常合成で色を残し、加算は閃光と小さな火花だけに使う。shock は dir.mode: even で真円の輪に、破片（chunks / debris）は turn で回しながら飛ばす。",
  "duration": 1.0,
  "emitters": [
    {
      "name": "billow",
      "count": 12,
      "mode": "loop",
      "shape": "circle",
      "size": 7.0,
      "color": [
        "@smoke",
        "@ash"
      ],
      "life": {
        "base": 0.5,
        "vary": 0.4
      },
      "speed": {
        "base": 60.0,
        "vary": 0.5,
        "over": {
          "kind": "easeOut",
          "power": 1.6
        }
      },
      "dir": {
        "base": 0.0,
        "spread": 360.0
      },
      "spawn": {
        "w": 14.0,
        "h": 10.0
      },
      "accel": {
        "x": 0.0,
        "y": -24.0
      },
      "sizeOver": {
        "kind": "linear",
        "from": 0.5,
        "to": 2.2
      },
      "alphaOver": {
        "kind": "linear",
        "from": 0.6,
        "to": 0.0
      },
      "blend": "normal",
      "zIndex": 18
    },
    {
      "name": "puff",
      "count": 10,
      "mode": "burst",
      "shape": "circle",
      "size": 7.0,
      "color": [
        "@smoke",
        "@ash"
      ],
      "life": {
        "base": 0.8,
        "vary": 0.3
      },
      "speed": {
        "base": 110.0,
        "vary": 0.4,
        "over": {
          "kind": "easeOut",
          "power": 1.6
        }
      },
      "dir": {
        "base": 0.0,
        "spread": 360.0
      },
      "sizeOver": {
        "kind": "linear",
        "from": 0.5,
        "to": 2.0
      },
      "alphaOver": {
        "kind": "linear",
        "from": 0.6,
        "to": 0.0
      },
      "blend": "normal",
      "zIndex": 20
    },
    {
      "name": "fireball",
      "count": 12,
      "mode": "burst",
      "shape": "circle",
      "size": 12.0,
      "color": [
        "@flameHot",
        "@flame",
        "@flameDeep"
      ],
      "life": {
        "base": 0.3,
        "vary": 0.3
      },
      "speed": {
        "base": 150.0,
        "vary": 0.4,
        "over": {
          "kind": "easeOut",
          "power": 1.8
        }
      },
      "dir": {
        "base": 0.0,
        "spread": 360.0
      },
      "sizeOver": {
        "kind": "linear",
        "from": 0.8,
        "to": 1.6
      },
      "alphaOver": {
        "kind": "linear",
        "from": 0.85,
        "to": 0.0
      },
      "blend": "normal",
      "zIndex": 19
    },
    {
      "name": "chunks",
      "count": 12,
      "mode": "burst",
      "shape": "box",
      "size": 4.5,
      "color": [
        "@ash"
      ],
      "life": {
        "base": 0.6,
        "vary": 0.4
      },
      "speed": {
        "base": 230.0,
        "vary": 0.55,
        "over": {
          "kind": "easeOut",
          "power": 2.0
        }
      },
      "dir": {
        "base": 0.0,
        "spread": 360.0
      },
      "turn": {
        "base": 0.0,
        "spread": 1.0,
        "spin": 0.0,
        "spinSpread": 3.0
      },
      "accel": {
        "x": 0.0,
        "y": 400.0
      },
      "sizeOver": {
        "kind": "linear",
        "from": 1.0,
        "to": 0.5
      },
      "alphaOver": {
        "kind": "linear",
        "from": 1.0,
        "to": 0.0
      },
      "blend": "normal",
      "zIndex": 20
    },
    {
      "name": "debris",
      "count": 26,
      "mode": "burst",
      "shape": "box",
      "size": 2.6,
      "color": [
        "@spark",
        "@flame",
        "@flameDeep"
      ],
      "life": {
        "base": 0.65,
        "vary": 0.5
      },
      "speed": {
        "base": 300.0,
        "vary": 0.6,
        "over": {
          "kind": "easeOut",
          "power": 2.0
        }
      },
      "dir": {
        "base": 0.0,
        "spread": 360.0
      },
      "turn": {
        "base": 0.0,
        "spread": 1.0,
        "spin": 0.0,
        "spinSpread": 5.0
      },
      "accel": {
        "x": 0.0,
        "y": 320.0
      },
      "sizeOver": {
        "kind": "linear",
        "from": 1.0,
        "to": 0.35
      },
      "alphaOver": {
        "kind": "fadeOut"
      },
      "blend": "normal",
      "zIndex": 20
    },
    {
      "name": "shock",
      "count": 26,
      "mode": "burst",
      "shape": "box",
      "size": 3.0,
      "color": [
        "@flameHot",
        "@flame"
      ],
      "life": {
        "base": 0.26,
        "vary": 0.0
      },
      "speed": {
        "base": 520.0,
        "vary": 0.08,
        "over": {
          "kind": "easeOut",
          "power": 3.0
        }
      },
      "dir": {
        "base": 0.0,
        "spread": 360.0,
        "mode": "even"
      },
      "turn": {
        "base": 0.0,
        "spread": 1.0,
        "spin": 0.0,
        "spinSpread": 8.0
      },
      "sizeOver": {
        "kind": "linear",
        "from": 1.2,
        "to": 0.15
      },
      "alphaOver": {
        "kind": "fadeOut"
      },
      "blend": "add",
      "zIndex": 21
    },
    {
      "name": "flash",
      "count": 1,
      "mode": "burst",
      "shape": "glow",
      "size": 64.0,
      "color": [
        "#ffffff",
        "@flameHot"
      ],
      "life": {
        "base": 0.17,
        "vary": 0.0
      },
      "alphaOver": {
        "kind": "fadeOut"
      },
      "blend": "add",
      "zIndex": 22
    },
    {
      "name": "sparks",
      "count": 12,
      "mode": "burst",
      "shape": "box",
      "size": 1.8,
      "color": [
        "@flameHot",
        "@spark"
      ],
      "life": {
        "base": 0.3,
        "vary": 0.4
      },
      "speed": {
        "base": 380.0,
        "vary": 0.5,
        "over": {
          "kind": "easeOut",
          "power": 2.4
        }
      },
      "dir": {
        "base": 0.0,
        "spread": 360.0
      },
      "turn": {
        "base": 0.0,
        "spread": 1.0,
        "spin": 0.0,
        "spinSpread": 10.0
      },
      "alphaOver": {
        "kind": "fadeOut"
      },
      "blend": "add",
      "zIndex": 21
    }
  ]
}
