{
  "version": 1,
  "name": "spark",
  "note": "縁石すれすれ・押し合い・ドリフト中の後輪の火花。橙の粒が後ろへ散って落ちる。ドリフト中は View がこれを短い周期で焚き直し、ゲージの貯まり具合で濃さを変える（危険な走りが溜まっている手応え）。",
  "duration": 0.8,
  "emitters": [
    {
      "name": "chips",
      "count": 18,
      "mode": "burst",
      "shape": "box",
      "size": 2.2,
      "color": [
        "#ffffff",
        "@spark",
        "@flame"
      ],
      "life": {
        "base": 0.35,
        "vary": 0.45
      },
      "speed": {
        "base": 150.0,
        "vary": 0.55,
        "over": {
          "kind": "easeOut",
          "power": 2.0
        }
      },
      "dir": {
        "base": 180.0,
        "spread": 150.0
      },
      "accel": {
        "x": 0.0,
        "y": 200.0
      },
      "sizeOver": {
        "kind": "linear",
        "from": 1.0,
        "to": 0.35
      },
      "alphaOver": {
        "kind": "fadeOut"
      },
      "blend": "add",
      "zIndex": 15
    },
    {
      "name": "flare",
      "count": 2,
      "mode": "burst",
      "shape": "glow",
      "size": 6.0,
      "color": [
        "@flameHot",
        "@flame"
      ],
      "life": {
        "base": 0.18,
        "vary": 0.3
      },
      "speed": {
        "base": 90.0,
        "vary": 0.4,
        "over": {
          "kind": "easeOut",
          "power": 2.0
        }
      },
      "dir": {
        "base": 180.0,
        "spread": 120.0
      },
      "alphaOver": {
        "kind": "fadeOut"
      },
      "blend": "add",
      "zIndex": 16
    }
  ]
}
