{
  "version": 1,
  "name": "drift_smoke",
  "note": "ドリフト中に後輪から湧く白煙。走りながら 0.09 秒おきに 1 発ずつ焚く（発生は World、絵は Fx.drawAll）。dir を 180 度（画面の下 = 後ろ）に向け、accel でさらに後ろへ引くので、湧いた煙は路面に沿って後ろへ長く尾を引く。薄い veil・濃い puffs・跳ねる grit の 3 層。ニトロの噴射炎・クラッシュの閃光と釣り合う大きさにしてある（滑っていることが静止画でも読める強さ）。",
  "duration": 1.2,
  "emitters": [
    {
      "name": "veil",
      "count": 11,
      "mode": "burst",
      "shape": "circle",
      "size": 20.0,
      "color": [
        "@smoke",
        "@ash"
      ],
      "life": {
        "base": 1.0,
        "vary": 0.3
      },
      "speed": {
        "base": 115.0,
        "vary": 0.4,
        "over": {
          "kind": "easeOut",
          "power": 1.5
        }
      },
      "dir": {
        "base": 180.0,
        "spread": 60.0
      },
      "spawn": {
        "w": 12.0,
        "h": 4.0
      },
      "accel": {
        "x": 0.0,
        "y": 115.0
      },
      "sizeOver": {
        "kind": "linear",
        "from": 0.8,
        "to": 3.8
      },
      "alphaOver": {
        "kind": "linear",
        "from": 0.6,
        "to": 0.0
      },
      "blend": "normal",
      "zIndex": 13
    },
    {
      "name": "puffs",
      "count": 15,
      "mode": "burst",
      "shape": "circle",
      "size": 11.0,
      "color": [
        "#ffffff",
        "@smoke",
        "@ash"
      ],
      "life": {
        "base": 0.78,
        "vary": 0.3
      },
      "speed": {
        "base": 180.0,
        "vary": 0.45,
        "over": {
          "kind": "easeOut",
          "power": 1.8
        }
      },
      "dir": {
        "base": 180.0,
        "spread": 34.0
      },
      "spawn": {
        "w": 11.0,
        "h": 3.0
      },
      "accel": {
        "x": 0.0,
        "y": 155.0
      },
      "sizeOver": {
        "kind": "linear",
        "from": 0.6,
        "to": 3.0
      },
      "alphaOver": {
        "kind": "peak",
        "at": 0.1
      },
      "blend": "normal",
      "zIndex": 14
    },
    {
      "name": "grit",
      "count": 12,
      "mode": "burst",
      "shape": "box",
      "size": 2.0,
      "color": [
        "@ash"
      ],
      "life": {
        "base": 0.5,
        "vary": 0.5
      },
      "speed": {
        "base": 250.0,
        "vary": 0.5,
        "over": {
          "kind": "easeOut",
          "power": 2.2
        }
      },
      "dir": {
        "base": 180.0,
        "spread": 70.0
      },
      "accel": {
        "x": 0.0,
        "y": 260.0
      },
      "sizeOver": {
        "kind": "linear",
        "from": 1.0,
        "to": 0.4
      },
      "alphaOver": {
        "kind": "fadeOut"
      },
      "blend": "normal",
      "zIndex": 15
    }
  ]
}
